message,label
im boat still moms check yo im half naked,0
bank granite issues strongbuy explosive pick members nasdaq symbol cdgt per,1
r giving second chance rahul dengra,0
played smash bros ltgt religiously,0
private account statement shows unredeemed points call identifier code expires,1
g says never answer texts confirmdeny,0
lost pound help,1
okey dokey iû÷ll bit sorting stuff,0
come people,0
wah lucky man save money hee,0
much better thanks lol,0
madamregret disturbancemight receive reference check dlf premaricakindly informedrgdsrakheshkerala,0
im coming home dinner,0
ok,0
ì decide faster cos sis going home liao,0
hi mate rv u hav nice hol message say hello coz havenåõt sent u ages started driving stay roadsrvx,0
amazing rearrange letters gives meaning dormitory dirty room astronomer moon starer eyes see election results lies lets recount motherinlaw woman hitler eleven plus two twelve plus one amazing,0
good morning plz call sir,0
k actually guys meet sunoco howard right way,0
new theory argument wins situation loses person dont argue ur friends kick amp say im always correct,0
oh yeah diet flew window,0
watching cartoon listening music amp eve go temple amp church u,0
india win level series means record,0
armand says get ass epsilon,0
tell said eat shit,0
oh phone phoned disconnected,0
please call customer service representative freephone ampm guaranteed å£ cash å£ prize,1
hey sweet wondering moment might come want send file someone wont go yahoo connection sucks remember set page go download format disc could tell know way download big files download stuff directly internet help would great prey teasing kiss,0
purity friendship two smiling reading forwarded messageits smiling seeing name gud evng,0
heard u call night knickers make beg like u last time xx luv nikiyunet,1
place man,0
welp apparently retired,0
haha money leh later got go tuition haha looking empty slots driving lessons,0
aiyar hard type u later free tell call n scold n tell u,0
k ill call im close,0
wat late still early mah juz go dinner lor aiya dunno,0
yup paragon havent decided whether cut yet hee,0
watching tv got new job,0
private account statement shows unredeemed bonus points claim call identifier code expires,1
great run ttyl,0
hello love goes day wish well fine babe hope find job prospects miss boytoy teasing kiss,0
zoe hit im fucking shitin il defo try hardest cum morow luv u millions lekdog,0
text way cup stop work bus,0
congratulations ore mo owo wa enjoy wish many happy moments fro wherever go,0
good morning im suffering fever dysentry able come office today,0
tell pa pain de,0
got seventeen pounds seven hundred ml ûò hope ok,0
know complain num onlybettr directly go bsnl offc nd apply,0
kate jackson rec center ish right,0
kkcongratulation,0
whatsup dont u want sleep,0
lost å£ help,1
japanese proverb one u none itu must indian version one let none itleave finally kerala version one stop none make strike,0
search happiness main sources unhappiness accept life way comes u find happiness every moment u live,0
ok,0
faith makes things possiblehope makes things worklove makes things beautifulmay three christmasmerry christmas,0
ok c ya,0
im class holla later,0
buy space invaders chance win orig arcade game console press games arcade std wap charge see ocoukgames terms settings purchase,1
house water dock boat rolled newscaster dabbles jazz flute behind wheel,0
oh baby house come dont new pictures facebook,0
thx well months,0
gud mrng dear nice day,0
yar wanted scold u yest late already got zhong se qing u ask b ask ill go w u lor n u still act real,0
say slowly godi love amp need youclean heart bloodsend ten special people amp u c miracle tomorrow itplspls,0
yes princess want catch big strong hands,0
wait know wesleys town bet hella drugs,0
problem renewal ill right away dont know details,0
part dont initiate dont understand,0
moon come color dreams stars make musical sms give warm peaceful sleep good night,0
stand away doesnt heart ache without dont wonder dont crave,0
urgent important information user today lucky day find log onto httpwwwurawinnercom fantastic surprise awaiting,1
oz guy kinda flaky one friend interested picking ltgt worth tonight possible,0
waiting machan call free,0
honeybee said im sweetest world god laughed amp said waitu havnt met person reading msg moral even god crack jokes gmgngegn,0
gas station go,0
yes ammaelife takes lot turns sit try hold steering,0
hmm shall bring bottle wine keep us amused joking ill still bring bottle red white see tomorrow,0
sorry missed babe late slept hope enjoy driving lesson boytoy miss teasing kiss,0
ok thanx gd nite ì,0
polyphonic tone ur mob every week txt pt st tone free get txtin tell ur friends ptone reply hl info,1
nothing really making sure everybodys speed,0
wish holding tightly making see important much mean much need life,0
lol would mom would fit tell whole family crazy terrible,0
good well find way,0
iåõm cool ta luv vtired cause doin loads planning wk got social services inspection nursery take care spk sn x,0
sorry light turned green meant another friend wanted ltgt worth may around,0
que pases un buen tiempo something like,0
watching telugu moviewat abt u,0
mm ask come enough,0
winner valued network customer selected receivea å£ prize reward claim call claim code kl valid hours,1
yar lor keep raining non stop u wan go elsewhere,0
otherwise part time job natuition,0
good words words may leave u dismay many times,0
oooh bed ridden ey thinking,0
oclock mine bash flat plan,0
gsoh good spam ladiesu could b male gigolo join uks fastest growing mens club reply oncall mjzgroup stop reply stop msgå£rcvd,1
gram usually runs like ltgt half eighth smarter though gets almost whole second gram ltgt,0
im good thinking,0
one day crab running sea shorethe waves came n cleared footprints crab crab asked frnd r u clearing beautiful footprints waves replied fox following ur footprints catch thats cleared frndsship never lets u dwn gud nyt,0
dunno jus say go lido time,0
free msg get gnarls barkleys crazy ringtone totally free reply go message right,1
always saying welp,0
get official england poly ringtone colour flag yer mobile tonights game text tone flag optout txt eng stop box wwx å£,1
gud mrng dear hav nice day,0
also thk fast xy suggest one u dun wan ok going rain leh got gd,0
fran decided go n e way im completely broke knackered got bout c u mrw love janx ps dads fone credit,0
message free welcome new improved sex dogging club unsubscribe service reply stop msgsp,1
free st week nokia tone ur mobile every week txt nokia get txting tell ur mates wwwgetzedcouk pobox wwq normptone,1
cool like swimming pool jacuzzi house,0
course guess gods got hold right,0
oh getting even u u,0
whos class,0
loosu go hospital de dont let careless,0
k roommate also wants dubsack another friend may also want plan bringing extra ill tell know sure,0
oh haha den shld went today gee nvm la kaiez dun mind goin jazz oso scared hiphop open cant catch,0
im happy babe woo hoo party dude,0
allo braved buses taken trains triumphed mean weû÷re bû÷ham jolly good rest week,0
tell need investigate anywhere,0
urgent please call abta complimentary spanish holiday å£ cash await collection sae tcs box po ez ppm,1
call ok said call,0
urgent mobile awarded å£ bonus caller prize final try contact u call landline boxwrc ppm,1
miss call miss call khelate kintu opponenter miss call dhorte lage thats rule one great phone receiving quality wins,0
wifehow knew time murder exactly,0
u lunch alone bored,0
true lov n care wil nevr go unrecognized though somone often makes mistakes valuing definitly undrstnd start missing,0
thought king hill thing,0
thk ì gotta go home urself cos ill b going shopping frens present,0
studying ill free next weekend,0
love ya try budget money better babe gary would freak knew,0
ok,0
genius whats brother pls send number skype,0
want get laid tonight want real dogging locations sent direct ur mob join uks largest dogging network bt txting gravel nt eca pmsgp,1
wishing family merry x mas happy new year advance,0
fujitsu series lifebook good,0
friendship poem dear dear u r near hear dont get fear live cheer tear u r always dear gud ni,0
haha yeah oz kind shitload,0
make girl happy difficult make girls happy u need friend companion lover chef ltgt good listener ltgt organizer ltgt good boyfriend ltgt clean ltgt sympathetic ltgt athletic ltgt warm ltgt courageous ltgt determined ltgt true ltgt dependable ltgt intelligent ltgt psychologist ltgt pest exterminator ltgt psychiatrist ltgt healer ltgt stylist ltgt driver aaniye pudunga venaam,0
arun u transfr amt,0
prabhaim sorydarealyfrm heart im sory,0
part checking iq,0
nothing splwat abt u whr ru,0
yeah theres quite bit left ill swing tomorrow get,0
looks like found something smoke great job,0
babe got enough money pick bread milk ill give back get home,0
askd u question hours answer,0
todays voda numbers ending selected receive award match please call quoting claim code standard rates app,1
dont pick call something important tell hrishi,0
text banneduk see cost p textoperator gga xxx,1
missing toopray inshah allah,0
hello peach cake tasts lush,0
guessin aint gonna,0
anyways go gym whatever love smiles hope ok good day babe miss much already,0
probably still going stuff,0
got call landline number asked come anna nagar go afternoon,0
dude ive seeing lotta corvettes lately,0
world suffers lot violence bad people silence good people,0
dear dave final notice collect tenerife holiday cash award call landline tcs sae box cwwx ppm,1
come back tampa ffffuuuuuuu,0
want please inside outside bedroom,0
hey pple nightsexcellent location wif breakfast hamper,0
oh send address,0
sorry cant take call right happens r waxsto wat want come ill get medical insurance shell able deliver basic care im currently shopping right medical insurance give til friday morning thats ill see major person guide right insurance,0
u wake already wat u u picking us later rite im taking sq reaching ard smth like dat u check e arrival time c ya soon,0
farm open,0
speaking cash yet,0
dont make life stressfull always find time laugh may add years life surely adds life ur years gud niswt dreams,0
lmao ok wont needing u hair anymore,0
uncles atlanta wish guys great semester,0
ultimately tor motive tui achieve korli,0
please come imin towndontmatter urgoin outlr,0
moment dayhas valuemorning brings hopeafternoon brings faithevening brings luvnight brings restwish u find todaygood morning,0
december mobile mths entitled update latest colour camera mobile free call mobile update co free,1
emailed yifeng part oredi ì get fr,0
objection bf coming,0
come home dont want u miserable,0
congrats mobile g videophones r call videochat wid ur mates play java games dload polyh music noline rentl bx ip pm,1
born god said oh another idiot born,0
dont prize go another customer tc wwwtcbiz pmin polo ltd suite london wj hl please call back busy,1
wen ur lovable bcums angry wid u dnt take seriously coz angry childish n true way showing deep affection care n luv kettoda manda nice day da,0
yeah got list u joanna im feeling really anti social,0
see christmassy,0
k ill head mins see,0
tmobile customer may claim free camera phone upgrade pay go sim card loyalty call offer ends thfebtcs apply,1
guess useless calling u something important,0
hey sexy buns day word morning ym think,0
cant pick phone right pls send message,0
hear new divorce barbie comes kens stuff,1
thanks looking really appreciate,0
going join tomorrow,0
good luck draw takes place th feb good luck removal send stop customer services,1
says hi get ass back south tampa preferably kegger,0
wine flowing im nevering,0
cant think anyone spare room top head,0
hot live fantasies call p per min ntt ltd po box croydon cr wb national rate call,1
happened yo date,0
u secret admirer reveal thinks u r special call opt reply reveal stop per msg recd cust care,1
happen tell truth,0
nothing got msg frm tht unknown,0
could seen mei didt recognise face,0
sms ac jsco energy high u may know channel day ur leadership skills r strong psychic reply ans wquestion end reply end jsco,1
say somebody named tampa,0
yo theres class tmrw right,0
urgent mobile number awarded å£ prize guaranteed call land line claim valid hrs ppm,1
yes fine love safe,0
keep payasam rinu brings,0
need person give na,0
aiyah u ok already lar e nydc wheellock,0
nokia tone ur mob every week txt nok st tone free get txtin tell ur friends ptone reply hl info,1
campus library,0
enjoy showers possessiveness poured u ur loved ones bcoz world lies golden gift loved truly,0
surly ill give coming review,0
lord ringsreturn king store nowreply lotr june chance win lotr soundtrack cds stdtxtrate reply stop end txts,1
pls send comprehensive mail im paying much,0
current leading bid pause auction send customer care,1
waking afternoon sup,0
let know youve got money carlos make call,0
contacted dating service someone know find call mobile landline poboxldns,1
ki give kvb acc details,0
ok many buy,0
callsmessagesmissed calls,0
yo im parents gettin cash good news picked downstem,0
dear subscriber ur draw å£ gift voucher b entered receipt correct ans elvis presleys birthday txt answer,1
took tablets reaction morning,0
sister got placed birla soft da,0
keep seeing weird shit bein woah realising actually reasonable im oh,0
pls pls send mail know relatives coming deliver know costs risks benefits anything else thanks,0
use foreign stamps country good lecture,0
mom wants know,0
early bird purchases yet,0
bring got,0
okie,0
hiya good day spoken since weekend,0
japanese proverb one u none itu must indian version one let none itleave finally kerala version one stop none make strike,0
oh yeahand hav great time newquaysend postcard look girls im goneu know im talkin boutxx,0
try something dear read something exams,0
k makes sense btw carlos difficult guys gonna smoke go pick second batch get gas,0
hello wats talks email address,0
im reaching home min,0
though shd go n fun bar town something ûò sound ok,0
im okay chasing dream whats good next,0
sorry im stil fucked last nite went tobed got work,0
well wasnt available washob nobbing last night ask nickey platt instead,0
ello babe u ok,0
life spend someone lifetime may meaningless moments spent someone really love means life,0
wake since checked stuff saw true available spaces pls call embassy send mail,0
im home doc gave pain meds says everything fine,0
u sleeping going take haha got spys wat online checking n replying mails lor,0
loan purpose å£ å£ homeowners tenants welcome previously refused still help call free text back help,1
yeah give call youve got minute,0
lover need,0
know hows anthony bringing money ive school fees pay rent stuff like thats need help friend need,0
hoping would send message rent due dont enough reserves completely gone loan need hoping could balance ltgt way could get till mid march hope pay back,0
please dont text anymore nothing else say,0
supervisor find one lor thk students havent ask yet tell u aft ask,0
goodmorning today late ltdecimalgt min,0
hi hope good day better night,0
think one saying clearly ok leave need ask go come,0
hmm well night night,0
ur going bahamas callfreefone speak live operator claim either bahamas cruise ofå£ cash opt txt x,1
justbeen overa week since broke already brains going mush,0
dont thnk wrong calling us,0
û anyway many good evenings u,0
come around ltdecimalgt pm vikkyim otside nw il come tht time,0
updatenow xmas offer latest motorola sonyericsson nokia free bluetooth double mins txt orange call mobileupd calloptoutfq,1
calls later afternoon onwords mtnl service get problem south mumbai hear cannt listen,0
im bruce amp fowler im moms car cant park long story,0
still playing gautham,0
messages food,0
time want come,0
kgive back thanks,0
england v macedonia dont miss goalsteam news txt ur national team eg england trywales scotland txtì¼ poboxoxwwq,1
enjoy ur life good night,0
good evening ttyl,0
take exam march,0
aiyah ok wat long got improve already wat,0
sif one good partnership going take lead,0
u get message,0
u call,0
tell u headache want use hour sick time,0
never try alone take weight tear comes ur heart falls ur eyes always remember stupid friend share bslvyl,0
rajipls favour pls convey birthday wishes nimya pls today birthday,0
time iû÷m prob,0
hi kate lovely see tonight ill phone tomorrow got sing guy gave card xxx,0
usualiam fine happy amp well,0
nope watching tv home going v bored,0
ps u ur grown right,0
k wat tht incident,0
u awake snow,0
shes good wondering wont say hi shes smiling coping long distance,0
intrepid duo great time see soon,0
gobi arts college,0
credits topped httpwwwbubbletextcom renewal pin tgxxrz,1
thought put back box,0
wnt buy bmw car urgentlyits vry urgentbut hv shortage ltgt lacsthere source arng dis amt ltgt lacsthats prob,0
hi mobile ltgt added contact list wwwfullonsmscom great place send free sms people visit fullonsmscom,0
easy ahsen got selected means good,0
know im lacking particular dramastorms details part im worried,0
kkhow business,0
probably earlier stations think,0
sorryin meeting ill call later,0
forwarded hi mailbox messaging sms alert matches please call back retrieve messages matches ccpmin,1
got another job one hospital data analysis something starts monday sure thesis got finished,0
free entry grprizes wkly comp chance win latest nokia psp å£ cash every wktxt great httpwwwgrprizescom,1
call youcarlos isare phones vibrate acting might hear texts,0
im smoking people use wylie smokes much justify ruining shit,0
want new video phone anytime network mins text five pounds per week call reply delivery tomorrow,1
sounds great home,0
kthen special,0
number u live,0
oh fuck juswoke bed boatin docks slept wid year old spinout giv u da gossip lr xxx,0
knock knock txt whose enter r weekly draw å£ gift voucher store yr choice tcs wwwtklscom age stoptxtstopå£week,1
tessypls favor pls convey birthday wishes nimyapls dnt forget today birthday shijas,0
dice art class thru thanks though idea time come tomorrow,0
u got persons story,0
yeah totes u wanna,0
sorry dai thought calling lot timeslil busyi call noon,0
wasnt paying attention,0
good morning love go sleep wish great day full feeling better opportunity last thought babe love kiss,0
u drive lor,0
huh slow tot u reach long ago liao u days leh,0
dun cut short leh u dun like ah failed shes quite sad,0
shopping lor raining mah hard leave orchard,0
never blame day ur life good days give u happiness bad days give u experience essential life gods blessings good morning,0
ok april cant wait,0
love daddy make scream pleasure going slap ass dick,0
yes reg ciao,0
nd time tried contact u u å£ prize claim call b tcsstop sms ppm,1
told number gautham,0
someonone know trying contact via dating service find could call mobile landline boxskch,1
got c lazy type forgot ì lect saw pouch like v nice,0
sad story man last week bday wife didnt wish parents forgot n kids went work even colleagues wish,0
nice day today love dearly,0
drop tank,0
sunshine hols claim ur med holiday send stamped self address envelope drinks us uk po box bray wicklow eire quiz starts saturday unsub stop,1
oh k got job whats,0
indeed way either,0
sorry ill call later ok bye,0
hi harishs rent transfred ur acnt,0
urgent urgent free flights europe give away call b th sept take friend free call claim bannfwflyppm,1
hide anythiing keeping distance,0
met stranger choose friend long world stands friendship never ends lets friends forever gud nitz,0
welcome ukmobiledate msg free giving free calling future mgs billed p daily cancel send go stop,1
hanks lotsly,0
awarded sipix digital camera call landline delivery within days cs box mbp yr warranty ppm p på£,1
hi wlcome back wonder got eaten lion something nothing much,0
yup,0
lol dont know awesome phone could click delete right want,0
current food alone also,0
got job wiproyou get every thing life years,0
gentle princess make sweet gentle love,0
friendship poem dear dear u r near hear dont get fear live cheer tear u r always dear gud ni,0
yay better told girls either,0
esplanade lor else,0
thanks hope good day today,0
hmmmbut give one day,0
texted finished long time ago showered erything,0
enjoy watching playing football basketball anything outdoors,0
double mins txts months free bluetooth orange available sony nokia motorola phones call mobileupd calloptoutndx,1
good evening roger,0
ok wahala remember friend need,0
accidentally brought em home box,0
aight thanks comin,0
hey tmr maybe meet yck,0
im lip synced shangela,0
pls needs dat slowly vomit,0
im watching lotr w sis dis aft u wan meet dinner nite,0
hi finally completed course,0
whenwhere pick,0
yes possible dint try pls dont tell one k,0
hey happened u switch ur cell whole day isnt good u care give call tomorrow,0
alrite hunnywot u nite didnt end goin town jus da pub instead jus chillin da mo bedroomlove jen xxx,0
wif family booking tour package,0
darren saying dat u meeting da ge den dun meet dinner cos later u leave xy feel awkward den u meet lunch lor,0
aight sorry take ten years shower whats plan,0
ok u tell wat time u coming later lor,0
anything lor,0
back brum thanks putting us keeping us happy see soon,0
times,0
happy birthday may ur dreams come true,0
wylie update weed dealer carlos went freedom class lunsford,0
im realy soz imat mums nite moro,0
ya came ago,0
awesome text youre restocked,0
badrith chennaii surely pick usno competition,0
yup thk u oso boring wat,0
wat uniform get,0
pls ask macho much budget bb bold cos saw new one ltgt dollars,0
sorry ill call later,0
anytime,0
please give pick tuesday evening ok,0
freemsg hey im buffy love satisfy men home alone feeling randy reply c pix qlynnbv helpp msg send stop stop txts,1
even friend priest call,0
probably ltgt,0
im sorry ive joined league people dont keep touch mean great deal friend times even great personal cost great week,0
gain rights wifedont demand iti trying husband toolets see,0
know grumpy old people mom like better lying always one play jokes,0
oops ltgt,0
im done studyn library,0
problem baby good time talk called left message,0
yo dude guess got arrested day,0
ha us e thing got tv watch u thk go tonight u already haf smth mind,0
thanks bomb date phone wanted say,0
hi elaine todays meeting confirmed,0
kkhow sister kids,0
nice talking please dont forget pix want see,0
damn poor zac doesnt stand chance,0
thats fine give call knows wants questions,0
love aathilove u lot,0
hello per request ltgt rs transfered,0
derek done class,0
thank youve wonderful,0
says hell give call friends got money hes definitely buying end week,0
whats significance,0
urgent trying contact last weekends draw shows å£ prize guaranteed call claim code valid hrs,1
well meant opposed drunken night,0
sorry never hear unless book one kinda jokethet really looking skinny white girls one lineyou much camera something like theyre casting look,0
pub,0
hasnt pattern recently crap weekends,0
prakesh know,0
said u mind go bedroom minute ok sed sexy mood came minuts latr wid caken wife,0
bored speed dating try speedchat txt speedchat dont like em txt swap get new chatter chat poboxwwq pmsg rcd,1
hoping get away langport still town tonight,0
great office today,0
site simulate test gives tough questions test readiness,0
likely called mittelschmertz google dont paracetamol dont worry go,0
dunno lei shd b driving lor cos go sch hr oni,0
ah well confuses things doesnt thought friends maybe wrong thing already sort invited tho may come cos money,0
nvm im going wear sport shoes anyway im going late leh,0
spending new years brother family lets plan meet next week ready spoiled,0
escape theatre going watch kavalan minutes,0
could work well reach consensus next meeting,0
cool let know kicks around ltgt ill day,0
waiti come ltgt min,0
ok ur typical reply,0
hope things went well doctors reminds still need godid u c little thing left lounge,0
thats cool liked photos sexy,0
pity mood soany suggestions,0
yet id like keep touch easiest way barcelona way ru house,0
got looks scrumptious daddy wants eat night long,0
watching house ûò entertaining ûò getting whole hugh laurie thing ûò even stick ûò indeed especially stick,0
ill ltgt ok,0
apart one told yesterday,0
happen dear silent tensed,0
prabhaim sorydarealyfrm heart im sory,0
hi mom might back later ltgt,0
noe la u wana pei bf oso rite k lor days den,0
tell friend come round til like ltgt ish,0
yeah got v apologetic n fallen actin like spoilt child got caught till wont go badly cheers,0
sir receive account another hr time sorry delay,0
kkare college,0
next month get upto calls ur standard network charge activate call c wirenet stterms pobox uz cost å£ min mobcudb,1
dont gimme lip caveboy,0
cant pick phone right pls send message,0
garage keys arent bookshelf,0
swhrt u deyhope ur ok tot u daylove n misstake care,0
hope know im still mad,0
found diff farm shop buy cheese way back call,0
im gonna rip uterus,0
gonna get rimac access,0
somewhere beneath pale moon light someone think u dreams come true goodnite amp sweet dreams,0
got meh,0
kkany special today,0
well join ltgt bus,0
ìï say like dat dun buy ericsson oso cannot oredi lar,0
asked sen come chennai search job,0
k need login anything,0
todays voda numbers ending selected receive award hava match please call quoting claim code standard rates app,1
hello need posh birds chaps user trial prods champneys put need address dob asap ta r,1
sorry ill call later,0
good day toopray meremove teeth painful maintaining stuff,0
yup remb think book,0
u free sat rite u wan watch infernal affairs wif n darren n mayb xy,0
night worrying appt shame missed girls night quizzes popcorn hair,0
dad get back,0
boo hows things im back home little bored already,0
remember day,0
might come kerala daysso prepared take leave finalise dont plan travel visitneed finish urgent works,0
