message,label
school starting stay whats weather like food social support system like friends school things important,0
may call later pls,0
fwiw reason im around time smoke gas afford around someone tells apparently happens somebody wants light,0
customer place wil cal u sir,0
hey hunonbus goin meet wants go meal donyt feel like cuz get last bus homebut hes sweet latelyxxx,0
cant feel nauseous im pissed didnt eat sweets week cause today planning pig dieting week im hungry,0
free today haf pick parents tonite,0
painful words thought happy toughest thing earth,0
know account detailsi ask mom send youmy mom reach,0
hi happy birthday hi hi hi hi hi hi hi,0
come tomorrow di,0
sounds like many talents would like go dinner date next week,0
yo im right yo work,0
home watching tv lor,0
aiyo bit pai seh ì noe scared dun rem die hee become better lookin oredi leh,0
mum hope great day hoping text meets well full life great day abiola,0
kkthis month kotees birthday know,0
want sent ltgt mesages today thats sorry hurts,0
ok feel like john lennon,0
yeah probs last night obviously catching speak soon,0
sir waiting call free please call,0
sorry cant help,0
yar tot u knew dis would happen long ago already,0
meeting da call,0
lost pounds since doc visit last week woot woot im gonna celebrate stuffing face,0
shall come get pickle,0
open rebtel firefox loads put plus sign user name place show two numbers lower number number pick number pin display okay,0
good afternoon love goes day woke early online waiting hmmm italian boy online see grins,0
responding,0
ok lor im town lei,0
ok cool see ya,0
hai priya right doctor said pa,0
yup song bro creative neva test quality said check review online,0
call meet,0
dont forget owns whos private property good boy always passionate kiss,0
package programs well,0
hmmmstill dont opener,0
im chennai velachery,0
sounds like plan cardiff still still cold im sitting radiator,0
unbelievable faglord,0
oh kkwhere take test,0
iû÷ll leave around four ok,0
also bringing galileo dobby,0
ha ha nan yalrigu heltiniiyo kothi chikku u shared many things wit meso far didnt told body even uttered word abt u ur trusting much tell others plz nxt time dont use words meok chikkub,0
im workin get job,0
sucks ill go u hair youll free right,0
see half hour,0
th july,0
dear take care reaching homelove u lot,0
u guys never invite anywhere,0
unique user id removal send stop customer services,1
yo guys ever figure much need alcohol jay trying figure much safely spend weed,0
block breaker comes deluxe format new features great graphics tmobile buy å£ replying get bbdeluxe take challenge,1
see requirements please,0
costa del sol holiday å£ await collection call toclaim sae tc pobox stockport skxh costå£pm maxmins,1
ok juz receive,0
dont know jack shit anything id sayask something helpful want pretend text whatever response hypotheticalhuagauahahuagahyuhagga,0
free entry å£ weekly comp send word enter tc wwwtextcompcom cust care,1
alright hooked guys,0
princess,0
k fyi x ride early tomorrow morning hes crashing place tonight,0
itû÷s å£ get ok,0
ltgt k oh send home sale,0
pdatenow double mins txts orange tariffs latest motorola sonyericsson nokia bluetooth free call mobileupd calloptoutyhl,1
dunno juz askin cos got card got salon called hair sense tot da one ì cut ur hair,0
love set soul fire spark flame big rawring flame xoxo,0
trip ok quite tiring lor uni starts today ok cos im taking modules jus concentrating final yr project,0
wonders world th th ur style th ur smile th ur personality rd ur nature nd ur sms st ur lovely friendship good morning dear,0
could read love answered,0
freeringtonereply real,1
always celebrate nys family,0
p per min call germany bt line p per min check planettalkinstantcom info ts cs text stop opt,1
hm good morning headache anyone,0
ask g iouri ive told story like ten times already,0
u nokia plus free digital camera u get u win free auction take part send nokia poboxtcrw,1
lets go bill millers,0
dont number gonna massive pain ass id rather get involved thats possible,0
somewhr someone surely made u god decided perfect time make u meet dat person till den enjoy ur crushes,0
howz persons story,0
account number,0
dear relieved westonzoyland going plan end,0
oh god happy see message days,0
ok finish,0
sitting mu waiting everyone get suite take shower,0
im putting ready lttimegt,0
min later k,0
sure whenever show fuck gt,0
way rencontre meet mountains dont,0
yeah lol luckily didnt starring role like,0
e msg jus u said thanks gift,0
bus way calicut,0
babe lost,0
congratulations thanks good friend u å£ xmas prize claim easy call p per minute btnationalrate,1
oh love soooo good hear omg missed much today im sorry problems provider thank tming,0
abt making pics bigger,0
read shame tell takes runs blame u ever really ever long time,0
wat time u finish ur lect today,0
xmas prize draws trying contact u todays draw shows å£ prize guaranteed call land line valid hrs,1
cant pick phone right pls send message,0
old orchard near univ,0
wifehow knew time murder exactly,0
bring home wendy,0
theyre lots places hospitals medical places safe,0
appt lttimegt fault u dont listen told u twice,0
said anything wrong sorry de,0
mmm yummy babe nice jolt suzy,0
treasure every moment spend together,0
private account statement shows unredeemed points call identifier code expires,1
k want us come,0
u repeat e instructions wats e road name ur house,0
ur luck love someone ur fortune love one loves u,0
im gonna able late notice ill home weeks anyway plans,0
dont message offer,0
ffffffffff alright way meet sooner,0
awarded sipix digital camera call landline delivery within days cs box mbp yr warranty ppm p på£,1
whats oga left phone home saw ur messages hope good great weekend,0
remind get shall,0
im ok wif cos like try new things scared u dun like mah cos u said loud,0
solve case man found murdered ltdecimalgt ltgt afternoon wife called police police questioned everyone wife siri sleeping murder took place cook cooking gardener picking vegetables housemaid went post office children went play neighbour went marriage police arrested murderer immediately whos reply reason u r brilliant,0
congrats year special cinema pass call c suprman v matrix starwars etc free bxipwe pm dont miss,1
ok careful dont text drive,0
good good job like entrepreneurs,0
ìll submitting da project tmr rite,0
reading gud habit nan bari hudgi yorge pataistha ertini kano,0
tell rob mack gf theater,0
thats cause old live high,0
come,0
xy going e lunch,0
tomorrow going theatre come wherever u call tell come tomorrow,0
huh cant thk oredi many pages,0
lol busy,0
get class bsn like ltgt minutes know advising,0
come,0
im see cant see maybe reboot ym seen buzz,0
ok stay night xavier sleeping bag im getting tired,0
great getting worried know wonderful caring person like best life know u r wonderful gods love,0
anyone calls treadmill say youll buy make sure working found ad craigslist selling ltgt,0
ur chance win å£ cash every wk txt play tscs wwwmusictrivianet custcare xpwk,1
haha okay today weekend leh,0
want funk ur fone weekly new tone reply tonesu text wwwringtonescouk original n best tones gbp network operator rates apply,1
squeeeeeze christmas hug u lik frndshp den hug back u get u r cute u r luvd u r lucky none people hate u,0
chosen receive å£ award pls call claim number collect award selected receive valued mobile customer,1
u sick still go shopping,0
mah b ill pick tomorrow,0
pick drop carso problem,0
er,0
ur chance win å£ wkly shopping spree txt shop tscs wwwtxtshopcom custcare xpwk,1
k call ah,0
yes meet town cos go gep home could text bus stop dont worry well finished march û ish,0
yeah dont see,0
new message please call,1
ìï bot notes oredi cos juz rem got,0
hey go jazz power yoga hip hop kb yogasana,0
thats one issues california okay snow manageable,0
someone u know asked dating service contact cant guess call revealed pobox sxy p,1
ill probably around mu lot,0
oh godtaken teethis paining,0
yesim office da,0
pls give food preferably pap slowly loads sugar take hour give water slowly,0
guaranteed award maybe even å£ cash claim ur award call free legitimat efreefone number wat u think,1
yup im free,0
en chikku nange bakra msg kalstiyathen teacoffee,0
hi email address changed,0
kkits goodwhen going,0
put sign choose number pin show right,0
shall send exe mail id,0
know friend already told,0
hi darlin finish u pick meet text back number luv kate xxx,0
dont know jabo abi,0
need strong arms,0
haha heard text youre around,0
thats love hear v see sundayish,0
peteis phone still jenny college leannewhat,0
nothing u dinner w us,0
jamster get free wallpaper text heart tc apply need help call,1
sure yet still trying get hold,0
cheers message zogtorius iåõve staring phone age deciding whether text,0
ive sent send,0
yar quite clever aft many guesses lor got ask bring thk darren willing go aiya thk leona still attach wat,0
jus chillaxin,0
u going ikea str aft dat,0
feb ltgt love u day send dis ur valued frnds evn comes back ull gt married person u luv u ignore dis u lose ur luv evr,0
whats coming hill monster hope great day things r going fine busy though,0
aight text address,0
sure check yahoo email sent photos yesterday,0
ìï thk wat eat tonight,0
dont search love let love find u thats called falling love bcoz u dont force u fall u know smeone hold u bslvyl,0
ur paper e morn aft tmr,0
tried contact reply offer video phone anytime network mins half price line rental camcorder reply call,1
yes trust u buy new stuff asap try,0
anything specific regards jaklin idk fuck,0
carlos pick ill swing usf little bit,0
white fudge oreos stores,0
cant pick phone right pls send message,0
dear sleeping p,0
selected stay top british hotels nothing holiday worth å£ claim call london bx swss,1
thk u dun haf hint e forum already lor cos told ron n darren going tell shuhui,0
good morning dear great amp successful day,0
im actor work work evening sleep late since im unemployed moment always sleep late youre unemployed every day saturday,0
youll rcv msgs chat svc free hardcore services text go u get nothing u must age verify yr network try,1
need coffee run tomocant believe time week already,0
good sleep rhythm person establish rhythm body learn use want know,0
ltgt think say syllabus,0
hey leave big deal take care,0
yup giving problems mayb ill jus leave,0
grandmas oh dear u still ill felt shit morning think hungover another night leave sat,0
shit babe thasa bit messed upyeh,0
todaysundaysunday holidayso work,0
pic please resend,0
weekend fine excuse much decorating,0
registered sinco payee log icicibankcom enter urn ltgt confirm beware frauds share disclose urn anyone,0
u need presnts always bcz u cant mis love jeevithathile irulinae neekunna prakasamanu sneham prakasam ennal prabha mns prabha islove got dont mis,0
send resume,0
jus finished avatar nigro,0
dunno lei might b eatin wif frens ì wan eat wait ì lar,0
merry christmas u annie,0
watever relation u built dis world thing remains atlast iz lonlines lotz n lot memories feeling,0
nope meanwhile talk say make greet,0
finished missing plenty,0
tell reached,0
thats cool gentleman treat dignity respect,0
orange customer may claim free camera phone upgrade loyalty call offer ends thmarch tcs apply optout availa,1
problem walk around julianaland oblivious going around say things constantly go one ear go whatever want dont know im upsetits dont listen tell going upset want surprised im mad,0
hope scared,0
supposed couldnt make shes still town though,0
sorry ill call later,0
need th im campus atm could pick hour two,0
two cartons u pleased shelves,0
noe ì specify da domain nusstu ìï still sch,0
havent left yet probably gonna til dinner,0
babe goes day miss already love loving kiss hope everything goes well,0
coming day class,0
awww dat sweet think something nice time tonight ill probably txt u later cos im lonely xxx,0
love come took long leave zahers got words ym happy see sad left miss,0
yavnt tried yet never played original either,0
yeah able ill text im ready meet,0
jane babes goin wrk feel ill lst nite foned already cover chuck,0
also cbe pay,0
whens radio show,0
k youre sure dont consent forms v,0
im outside islands head towards hard rock youll run,0
happy baby alright take job hope fine send kiss make smile across sea kiss kiss,0
urgent week free membership å£ prize jackpot txt word claim tc wwwdbuknet lccltd pobox ldnwarw,1
oic saw tot din c found group liao,0
love,0
wonders world th th ur style th ur smile th ur personality rd ur nature nd ur sms st ur lovely friendship good morning dear,0
many happy returns day wish happy birthday,0
hahahause brain dear,0
hiya comin bristol st week april les got rudi new yrs eve snoringthey drunk u bak college yet work sends ink bath,0
sorry dude dont know forgot even dan reminded sorry hope guys fun,0
dude got haircut breezy,0
thanks temales wonderful thank great week,0
weeks savamob member offers accessible call details savamob pobox la wu å£week savamob offers mobile,1
ok lor u wan go look u,0
dont respond imma assume youre still asleep imma start calling n shit,0
oic better quickly go bathe n settle,0
noice text youre,0
dawhats plan,0
youre still maybe leave credit card get gas get back like told,0
call senthil hsbc,0
whatever want know rules talk earlier week start happening showing responsibility yet every week bend rule way way whatever im tired thia argument every week ltgt movie doesnt inlude previews youre still getting,0
several sir,0
thats cool ill come like ltgt ish,0
sms services inclusive text credits pls goto wwwcomuknet login qxj unsubscribe stop extra charge help comuk cm ae,1
office around pm going hospital,0
even brother like speak treat like aids patent,0
cause im freaky lol,0
got lousy sleep kept waking every hours see cat wanted come worry cold,0
ok ive sent u da latest version da project,0
hmm dunno leh mayb bag goigng dat small jus anything except perfume smth dat keep,0
sorry flaked last night shits seriously goin roommate tonight,0
pocked,0
hello hun ru way im good dates guy met walkabout far meet soon hows everyone else,0
way,0
thats fine ill bitch later,0
hi kate u give ring asap xxx,0
nope wif sis lor aft bathing dog bathe looks like going rain soon,0
friendship game play word say doesnt start march ends may tomorrow yesterday today e,0
private account statement shows unredeemed points call identifier code expires,1
gotta collect da car lei,0
haf u eaten wat time u wan come,0
dont anybodys number still havent thought tactful way ask alex,0
greatest test courage earth bear defeat without losing heartgn tc,0
free st week nokia tone ur mob every week txt nokia get txting tell ur mates wwwgetzedcouk pobox wwq normptone,1
raviyog peripherals bhayandar east,0
howz painhope u r fine,0
kinda first one gets twelve aah speak tomo,0
dont know u u dont know send chat lets find pmsg rcvd hgsuitelandsrowwjhl ldn years,1
vote wherever heart guides,0
anything lor coming,0
tall princess,0
sorry ill call later,0
im school n ill da lab stuff give call ì r done,0
yeah hopefully tyler cant could maybe ask around bit,0
waiting call,0
much getting,0
well welp sort semiobscure internet thing,0
hi babe thanks coming even though didnt go welli wanted bed hope see soon love kisses xxx,0
uncle g checking rewarding month,0
waited yesterday,0
ur ringtone service changed free credits go clubmobilescom choose content stop txt club stop pwk club po box mk wt,1
message important information user today lucky day find log onto httpwwwurawinnercom fantastic surprise awaiting,1
still area restaurant ill try come back soon,0
important message final contact attempt important messages waiting customer claims dept expires call,1
either ideas know anyplaces something,0
customer place call,0
miss,0
goodmorningmy grandfather expiredso leave today,0
yeah basically time next week get away mom amp get,0
new theory argument wins situation loses person dont argue ur friends kick amp say im always correct,0
get ready put excellent sub face,0
hiya last night ive naughty bought clothes little ready shopping tho kind time wanna meet,0
shoot big loads get ready,0
january male sale hot gay chat cheaper call national rate pmin cheap pmin peak stop texts call pmin,1
heygreat dealfarm tour pm pax deposit may,0
ard like dat lor juz meet mrt station ì dun haf come,0
yeah right ill bring tape measure fri,0
comingdown later,0
much u trying get,0
pls dont forget study,0
sort code acc bank natwest reply confirm ive sent right person,0
bad girl still remember,0
well done england get official poly ringtone colour flag yer mobile text tone flag optout txt eng stop box wwx å£,1
maybe could get book tomo return immediately something,0
urgent mobile number awarded å£ prize guaranteed call land line claim valid hrs,1
sorry cant help,0
hello ucall wen u finish wrki fancy meetin wiv u tonite need break dabooks hrs last nite today wrk,0
ok chikku favourite song,0
thank meet monday,0
wat time ì wan today,0
hiya probably coming home weekend next,0
know ltgt ill around,0
gas station like block away house youll drive right since armenia ends swann take howard,0
ask around theres lot terms mids,0
promises though havent even gotten dinner yet,0
den weekdays got special price haiz cant eat liao cut nails oso muz wait finish drivin wat lunch still muz eat wat,0
bbq sat mine ish ur welcome come,0
bloody hell cant believe forgot surname mr ill give u clue spanish begins,0
k jason says hes gonna around ill around ltgt,0
yo gonna still stock tomorrowtoday im trying get dubsack,0
sorry ill call later,0
sorry datoday wont come playi driving clas,0
nah im goin wrks j wot bout u,0
ok u enjoy ur shows,0
jot things want remember later,0
u workin overtime nigpun,0
good afternoon love good see words ym get tm smart move slave smiles drink coffee await,0
didnt try g decided head,0
go jurong point crazy available bugis n great world la e buffet cine got amore wat,0
see thought,0
u ned convince tht possible witot hurting feeling main,0
want new video phone anytime network mins half price line rental free text months reply call free delivery,1
picking various points,0
send number give reply tomorrow morning said like ok,0
actually sleeping still might u call back text gr rock sis send u text wen wake,0
sorry lot friendofafriend stuff im talk actual guy wants buy,0
time tell friend around,0
getting tickets walsall tue th march mate getting sat ill pay treat want go txt bak terry,0
sorry meeting ill call later,0
opinion jada kusruthi lovable silent spl character matured stylish simple pls reply,0
lots used ones babe model doesnt help youi bring hell match,0
ur cashbalance currently pounds maximize ur cashin send go pmsg cc hgsuitelands rowwjhl,1
thanks loving rock,0
excellent spent ltgt years air force iraq afghanistan stable honest like traveling,0
r ì comin back dinner,0
yup msg tat yijue tot group mate cos meeting today mah im askin ì leaving earlier wat mah cos mayb ì haf walk v far,0
plz note anyone calling mobile co amp asks u type ltgt ltgt disconnect callcoz iz attempt terrorist make use sim card itz confirmd nokia n motorola n verified cnn ibn,0
want kiss feel next,0
call ltgt min thats ok,0
tomorrow going theatre come wherever u call tell come tomorrow,0
updatenow mths half price orange line rental minscall mobileupd calloptoutjq,1
hi spoke maneesha v wed like know satisfied experience reply toll free yes,0
nah wednesday bring mini cheetos bag,0
wish dont think gonna snow much flurries usually get melt hit ground eek havent snow since ltgt even born,0
iû÷ll look frying pan case itû÷s cheap book perhaps thatû÷s silly frying pan isnû÷t likely book,0
yun buying school got offer plus,0
yeah probably sure ilol let u know personally wuldnt bother ur goin mite well,0
ou guaranteed latest nokia phone gb ipod mp player å£ prize txt word collect ibhltd ldnwh pmtmsgrcvd,1
yeah jays sort fucking retard,0
happy saying,0
fine simply sitting,0
much r ì willing pay,0
serious like proper tongued,0
contract mobile mnths latest motorola nokia etc free double mins text orange tariffs text yes callback remove records,1
going bed prin,0
summers finally fancy chat flirt sexy singles yr area get matched reply summer free join optout txt stop help,1
didnt get ur full msgsometext missing send,0
wait ì inside da car park,0
oh oh den muz change plan liao go back yan jiu,0
consider walls bunkers shit important never play peaceful guess place high enough dont matter,0
india take lead,0
sos amount get pls,0
ok prob,0
yo howz u girls never rang india l,0
cant believe said many things morning really wanted say good morning love beautiful morning see library later,0
urgent trying contact u todays draw shows å£ prize guaranteed call land line claim c valid hrs,1
dunno u ask,0
dont run away frm u walk slowly amp kills u dont care enough stop,0
ree entry weekly comp chance win ipod txt pod get entry std txt rate tcs apply details,1
planning usually stops find hella weed,0
saw ron burgundy captaining party boat yeah,0
ok ill tell company,0
ok days making dinner tonite invited,0
dont let studying stress lr,0
dont run away frm u walk slowly amp kills u dont care enough stop,0
annoying isnt,0
hi birth lb oz mother baby brilliantly,0
stop however suggest stays someone able give ors every stool,0
wonder youll get text,0
mobile number å£ claim calls us back ring claims hot line,1
congratulations weeks competition draw u å£ prize claim call b tcsstop sms ppm,1
sale arsenal dartboard good condition doubles trebles,1
lol u drunkard hair moment yeah still tonight wats plan,0
babe im back come back,0
ya im referin meis ex wat ah waitin u treat somebody shld b rich liaoso gd den u dun work frm tmr onwards,0
engalnd telly decided wont let watch mia elliot kissing damn,0
dear call tmorrowpls accomodate,0
text doesnt reply let know log,0
u today,0
huh got lesson lei n thinkin going sch earlier n tot parkin kent vale,0
er mw im filled tuth aight,0
much ur hdd casing cost,0
mobile mths update latest cameravideo phones free keep ur number get extra free minstexts text yes call,1
wherres boytoy,0
freemsg claim ur sms messagestext ok nowuse webmobile ur mates etc join txtcom pwk tc box lawu remove txtx stop,1
doesnt make sense take unless free need know wikipediacom,0
tot u outside cos darren say u come shopping course nice wat jus went sim lim look mp player,0
ok come ur home half hour,0
notice like looking shit mirror youre turning right freak,0
best msg hard person u know one step foward make u fall love amp one step back ruin ur friendship good night,0
good evening sir hope nice day wanted bring notice late paying rent past months pay ltgt charge felt would inconsiderate nag something give great cost thats didnt speak however recession wont able pay charge month hence askin well ahead months end please help thank everything,0
hey mate hows u honeydid u ave good holiday gimmi de gossx,0
u hiding stranger,0
ic lol play doors sometime yo,0
alright omw gotta change order halfth,0
baaaaaaaabe wake miss crave need,0
ok shall talk,0
ok,0
wake ltgt morning,0
call tells u call claim å£ prize u enter ur mobile personal details prompts careful,1
hi love goes day fuck morning woke dropped cell way stairs seems alright phews miss,0
wan win meetgreet westlife u currently tour unbreakable untamed unkempt text cost p std text,1
great hear settling well whats happenin wit ola,0
storming msg wen u lift phne u say hello u knw wt real meaning hello name girl yes u knw dat girl margaret hello girlfrnd f grahmbell invnted telphone moralone get name person,0
enufcredeit tocallshall ileave uni get bus yor house,0
sea lays rock rock envelope envelope paper paper words,0
working eyes philosophy text u later bit free chat,0
okcome home vl nice meet v chat,0
board working fine issue overheating also reslove still software inst pending come around clock,0
lol happens vegas stays vegas,0
great new offer double mins double txt best orange tariffs get latest camera phones free call mobileupd free stoptxt tcs,1
lets pool money together buy bunch lotto tickets win get ltgt u get ltgt deal,0
mean come chase stated watch many movies want,0
hey babe friend cancel still visit,0
sorry grocers,0
frndship like needle clock though v r clock v r nt able met evn v meetitz seconds bt v alwys stay conected gud,0
hungry buy food good lei mum n yun dun wan juz buy little bit,0
meet ì depends ì wan lor,0
tried contact reply offer video handset anytime networks mins unlimited text camcorder reply call,1
living simple loving also simple laughing simple winning tooo simple simple difficult gud nte,0
ya nice ready thursday,0
wnt buy bmw car urgentlyits vry urgentbut hv shortage ltgt lacsthere source arng dis amt ltgt lacsthats prob,0
urgent ur awarded complimentary trip eurodisinc trav acoentry å£ claim txt dis å£morefrmmob shracomorsglsuplt ls aj,1
maybe woke fucking wouldnt problem,0
ok lor,0
haha think,0
different styles,0
dear mood cant drive brother drive,0
good afternoon starshine hows boytoy crave yet ache fuck sips cappuccino miss babe teasing kiss,0
reply name address receive post weeks completely free accommodation various global locations wwwphbcom php,1
ok good making money,0
yes please swimming,0
v nice sheffield tom air opinions categories b used measure ethnicity next census busy transcribing,0
taxt massagetiepos argh ok lool,0
ìï ready call,0
hiya u paying money account thanks got pleasant surprise checked balance u c dont get statements acc,0
supposed meet discuss abt trip thought xuhui told afternoon thought go lesson,0
weekly coolmob tones ready download weeks new tones include crazy frogaxel f akonlonely black eyeddont p info n,1
ha ha popped loo helloed hello,0
way send shades stuff wonderful,0
always putting business put pictures ass facebook one open people ive ever met would think picture room would hurt make feel violated,0
