message,label
ive reached home finally,0
bangbabes ur order way u receive service msg download ur content u goto wap bangb tv ur mobile internetservice menu,1
hey missed tm last night phone charge smiles meeting friend shortly,0
monthly amount terrible pay anything till months finishing school,0
havent got da topic yet rite,0
u r much close heart u go away shattered plz stay,0
ask u meeting da ge tmr nite,0
å£ xmas reward waiting computer randomly picked loyal mobile customers receive å£ reward call,1
rajipls favour pls convey birthday wishes nimya pls today birthday,0
rct thnq adrian u text rgds vatian,1
hi darlin work u get trouble ijust talked mum morning really good time last night im goin soon call u,0
id say thats good sign well know track record reading women,0
dun b sad dun thk abt already concentrate ur papers k,0
die want u stuffs,0
chance win free bluetooth headset simply reply back adp,1
dear voucher holder claim weeks offer pc please go httpwwwetlpcoukexpressoffer tscs apply stop texts txt stop,1
ssi thinl role like sachinjust standing others hit,0
seeking lady street freak sheets,0
worse uses half way stops better complete,0
sms ac sptv new jersey devils detroit red wings play ice hockey correct incorrect end reply end sptv,1
dont kick coco hes,0
ugh got outta class,0
sorry ill call later,0
im guy browsin compulsory,0
ìï comin fetch us oredi,0
u go back urself lor,0
ur cashbalance currently pounds maximize ur cashin send go pmsg cc po box tcrw,1
beautiful tomorrow never comes comes already today hunt beautiful tomorrow dont waste wonderful today goodmorning,0
replying boye changed phone number,0
therell minor shindig place later tonight interested,0
unsubscribed services get tons sexy babes hunks straight phone go httpgotbabescouk subscriptions,1
cant pick phone right pls send message,0
part checking iq,0
happy birthday may u find ur prince charming soon n dun work hard,0
k might come tonight class lets early,0
private account statement shows unredeemed points call identifier code expires,1
want ltgt rs dado,0
fine thanks,0
okie thanx,0
take like noon,0
please call immediately urgent message waiting,1
wondar full flim,0
shb b ok lor thanx,0
bored housewives chat n date btnational rate pmin landlines,1
take ltgt min,0
ugh gotta drive back sd la butt sore,0
whats ur pin,0
u ever get song stuck head reason wont go away til u listen like times,0
congratulations ur awarded cd vouchers gift guaranteed free entry wkly draw txt music,1
alright thanks advice enjoy night ima try get sleep,0
bold ltgt,0
take post come must texts happy reading one wiv hello caroline end favourite bless,0
hey loverboy love tell look picture ache feel legs fuck want need crave,0
aight im chillin friends room text youre way,0
thanks love torch bold,0
christmas occasion celebrated reflection ur values desires affectionsamp traditions ideal christmas,0
sure night menu know noon menu,0
anything lar ì going home dinner,0
soon real thing princess make wet,0
nope im drivin neva develop da photos lei,0
dropped em omw back,0
msg mobile content order resent previous attempt failed due network error queries customersqueriesnetvisionukcom,1
wont believe true incredible txts reply g learn truly amazing things blow mind ofwd ptxt,1
hi darlin ive got back really nice night thanks much lift see u tomorrow xxx,0
yunny im goin late,0
cha quiteamuzing thatåõscool babe,0
sent ur email id soon,0
jay told already,0
yeah work fine started last week stuff dull easy guys fun,0
ic lotta childporn cars,0
yo sorry shower sup,0
took mr owl licks,0
oh shit thought trip loooooool makes much sense grins sofa reference sleep couch link sent wasnt went trip oh didnt babe go celebration rents,0
st andre virgils cream,0
probably gonna see later tonight lt,0
call germany pence per minute call fixed line via access number prepayment direct access wwwtelediscountcouk,1
attended nothing,0
camera quite good mega pixels optical digital dooms lovely holiday safe hope hav good journey happy new year see couple weeks,0
hello darlin ive finished college txt u finish u love kate xxx,0
ok lar u sleep early nite,0
free day finish mon n thurs,0
nah im perpetual dd,0
u gd lor go shopping got stuff u wan watch infernal affairs come lar,0
didt play one day last year know even though good team like india,0
networking job,0
dont understand message,0
gonna let know cos comes bak holiday day coming dontgettext number,0
whole car appreciated last two dad map reading semi argument apart things going ok p,0
ill post lr class,0
life never much fun great came made truly special wont forget enjoy one gbpsms,1
got new year cos yetunde said wanted surprise didnt see money returned mid january ltgt day return period ended,0
adult content video shortly,1
win winner mr foley ipod exciting prizes soon keep eye ur mobile visit wwwwincouk,1
feb ltgt love u day send dis ur valued frnds evn comes back ull gt married person u luv u ignore dis u lose ur luv evr,0
sorry ive gone place ill tomorrow really sorry,0
hey elaine todays meeting still,0
good evening,0
half years missed friendship,0
ya telling abt tht incident,0
happy come noon,0
woke yeesh late didnt fall asleep til ltgt,0
liked new house,0
knowyetunde hasnt sent money yet sent text bother sending dont involve anything shouldnt imposed anything first place apologise,0
sorry sir call tomorrow senthilhsbc,0
stop wondering wow ever going stop tming tm whenever want mine laughs,0
ive told everything stop dont let get dehydrated,0
actually mobile full msg work online need send ltgt sent msg wil explain u later,0
havent lei next mon,0
hey got mail,0
freemsgfeelin kinda lnly hope u like keep company jst got cam moby wanna c pictxt reply date msgp rcv hlp stop,1
yo guess dropped,0
hey around ive got enough half ten owe,0
want explicit sex secs ring costs pmin gsex pobox wcn xx,1
free camera phones linerental month cross ntwk mins price txt bundle deals also avble call calloptoutj mf,1
nice pubs near frankie n bennys near warner cinema,0
ltgt great loxahatchee xmas tree burning update totally see stars,0
check audreys status right,0
yar else ill thk sorts funny things,0
gudnitetcpractice going,0
u outbid simonwatson shinco dvd plyr bid visit sms acsmsrewards end bid notifications reply end,1
home also,0
many people seems special first sight remain special till last sight maintain till life ends shjas,0
u r subscribed textcomp wkly comp st wks free question follows subsequent wks chargedpmsg unsubscribe txt stop custcare,1
huh fast dat means u havent finished painting,0
hot live fantasies call p per min ntt ltd po box croydon cr wb national rate call,1
time week ryan,0
rather prominent bite mark right cheek,0
omg want scream weighed lost weight woohoo,0
went project centre,0
ft good combination,0
havent planning buy later check already lido got show e afternoon u finish work already,0
ok thats cool either raglan rd edward rd behind cricket ground gimme ring ur closeby see tuesday,0
yes place town meet exciting adult singles uk txt chat pmsg,1
babe said hours almost internet,0
hmm many unfortunately pics obviously arent hot cakes kinda fun tho,0
received understood n acted upon,0
check maili mailed varma kept copy regarding membershiptake careinsha allah,0
ur cashbalance currently pounds maximize ur cashin send collect pmsg cc po box tcrw,1
haha hope ì hear receipt sound gd luck,0
kindly send one flat ltdecimalgt today,0
call number available appointment ask connect call waheed fathima,0
much got cleaning,0
hate turns fun shopping trip annoying day everything would look house,0
sorry ill call later,0
boo im way moms shes making tortilla soup yummmm,0
aww must nearly deadwell jez iscoming todo workand whilltake forever,0
awesome lemme know whenever youre around,0
ay wana meet satì wkg sat,0
cancel cheyyamoand get money back,0
got fujitsu ibm hp toshiba got lot model say,0
rajipls favour pls convey birthday wishes nimya pls today birthday,0
send logo ur lover names joined heart txt love name name mobno eg love adam eve yahoo poboxwwq txtno ads p,1
shall fine avalarr hollalater,0
plan pongal,0
tension ahwhat machiany problem,0
simply sitting watching match office,0
also da feel yesterday night wait til day night dear,0
unni thank dear rechargerakhesh,0
camera awarded sipix digital camera call fromm landline delivery within days,1
nvm ok,0
short cute good person,0
uve selected stay top british hotels nothing holiday valued å£ dial claim national rate call bx swss,1
surely dont forgot comei always touch,0
ill meet lobby,0
yeh def something sat,0
wot u thout u gonna call txt bak luv k,0
ok thk got u wan come wat,0
eastenders tv quiz flower dot compare violet e tulip f lily txt e f chance win å£ cash wkentp,1
hi hun im comin nitetell every im sorry hope u ava goodtimeoli rang melnite ifink mite b sortedbut il explain everythin monlrsx,0
congrats treat pendingi mail dayswill mail thrurespect mother homecheck mails,0
hey still want go yogasana coz end cine go bathe hav steam bath,0
ì ìï wan come come lor din c stripes skirt,0
ooh got im gonna start belly dancing moseley weds u want join cafe,0
ki send ltgt min,0
aight well head,0
ok,0
ill let know kicks,0
go write msg put dictionary mode cover screen hand press ltgt gently remove ur hand interesting,0
dun believe wat,0
well done luv ya,0
mum went dentist,0
want tell bad feel basically times text lately need drugs,0
started skye,0
lol nah wasnt bad thanks good b home quite reality check hows ur day u anything website,0
like peoples much shy pa,0
aight latest probably closer jay tyler two trips,0
got got colours lor one colour quite light n e darker lor actually im done shes styling hair,0
tension face smiling face waste face innocent face terror face cruel face romantic face lovable face decent face ltgt joker face,0
ill text drop x,0
rounderso required,0
dont wait til least wednesday see get,0
good baby,0
r u cooking dinner,0
still getting goods,0
wishing beautiful day moment revealing even things keep smiling enjoy,0
tiwary rcbbattle bang kochi,0
prepare pounded every night,0
say happen,0
hello beautiful r u ok ive kinda ad row wiv walked pub wanted night wiv u miss u,0
yar lor u noe u used dat route,0
,0
polyphonic tone ur mob every week txt pt st tone free get txtin tell ur friends ptone reply hl info,1
lol ok didnt remember til last nite,0
god picked flower dippeditinadew lovingly touched itwhichturnedinto u gifted tomeandsaidthis friend u,0
im going lunch wif family aft dat go str orchard lor,0
promotion number ur awarded city break could win å£ summer shopping spree every wk txt store skilgme tscswinawkage å£perwksub,1
ok,0
nope forgot show next week,0
buzzzz grins buzz ass buzz chest buzz cock keep phone vibrator feel shake,0
practising curtsey,0
dont want hear anything,0
go chase run shes crossing street,0
im way home went change batt watch go shop bit lor,0
yeah ill try scrounge something,0
merry christmas babe love ya kisses,0
friends u stay fb chat,0
oh get paid outstanding one commercial hasbroin august made us jump many hoops get paid still,0
one slice one breadstick lol,0
guaranteed å£ cash å£ prize claim yr prize call customer service representative ampm cost p,1
monthly password wap mobsicom use wap phone pc,1
yup,0
rushing im working im school rush go hungry,0
dont pack buy storelike cereals must pack food pack gari something ja miss,0
possible teach,0
aight let know youre gonna around usf,0
nah man car meant crammed full people,0
freemsg records indicate may entitled pounds accident claim free reply yes msg opt text stop,1
leaving yet ok lor go elsewhere n eat u thk,0
may call later pls,0
sms auction brand new nokia auction today auction free join take part txt nokia hgsuitelands rowwjhl,1
v skint fancied bevieswaz gona go meet othrs spoon jst bin watchng planet earthsofa v comfey dont make hav gd night,0
cant pick phone right pls send message,0
prasanth ettans mother passed away last night pray family,0
want kfc tuesday buy meals gravy mark,0
todays voda numbers ending selected receive å£ reward match please call quoting claim code standard rates apply,1
new mobiles must go txt nokia collect todayfrom å£ wwwtcbiz optout gbpmtmsg,1
ya even cookies jelly,0
still around looking pick later,0
dont know u u dont know send chat lets find pmsg rcvd hgsuitelandsrowwjhl ldn years,1
arr birthday today wish get oscar,0
stomach thru much trauma swear cant eat better lose weight,0
information ikea spelled caps yelling thought left sitting bed among mess came said going got home class please dont try bullshit makes want listen less,0
im done c ì,0
wuld without baby thought alone mite break donåõt wanna go crazy everyboy needs lady xxxxxxxx,0
goodo yes must speak friday eggpotato ratio tortilla needed,0
watching cartoon listening music amp eve go temple amp church u,0
u dun say early hor u c already say,0
pls whats full name jokes school cos fees university florida seem actually ltgt k pls holla back,0
going ride bike,0
freemsg hey darling weeks word back id like fun still tb ok xxx std chgs send å£ rcv,1
dont talk ever ok word,0
sunshine quiz wkly q win top sony dvd player u know country liverpool played mid week txt ansr å£ sptyrone,1
searching good dual sim mobile pa,0
new local dates area lots new people registered area reply date start wwwflirtpartyus replys,1
lol take member said aunt flow didnt visit months cause developed ovarian cysts bc way shrink,0
okay shining meant signing sounds better,0
sure neighbors didnt pick,0
actually first time went bed long spoke woke night,0
hows street end library walk,0
neshanthtel r u,0
willing go apps class,0
freemsg month unlimited free calls activate smartcall txt call subscriptngbpwk unlimited calls help stoptxt stop landlineonly,1
kkim also finewhen complete course,0
came hostel,0
dont want leave im barely stay sane fighting constantly isnt helping,0
ok lor,0
sorry de went shop,0
free polyphonic ringtone text super get free poly tone week sn pobox nr zs subscription pw,1
love u babe r u sure everything alrite idiot txt bak girlie,0
sorry mail,0
pls wont belive godnot jesus,0
uploaded mine facebook,0
hope youve settled new school year wishin gr day,0
delhi chennai still silent,0
im job profile seems like bpo,0
got ur mail dileepthank muchand look forward lots supportvery less contacts hereremember one venugopal mentionedtomorrow latei shall try come till theregoodnight dear,0
much buzy,0
ì b going esplanade fr home,0
final chance claim ur å£ worth discount vouchers today text yes savamob member offers mobile cs savamob pobox muz å£ subs,1
forgot working today wanna chat things ok drop text youre free bored etc ill ring hope well nose essay xx,0
aiyo lesson early im still sleepin haha okie u go home liao den confirm w lor,0
moneyas youmoney aint thinghow sha,0
lets use next week princess,0
think go honesty road call bank tomorrow tough decisions make us great people,0
msgs r time passthey silently say thinking u right also making u think least moment gd ntswt drms shesil,0
many times told stage use laugh listen aha,0
sorry battery died yeah im,0
today song dedicated day song u dedicate send ur valuable frnds first rply,0
heard job im going wildlife talk tonight u wantcome thatworzels wizzle whatever,0
alrite sam nic checkin ur numberso ittb,0
congratulations youve youre winner august å£ prize draw call prize code,1
oh wow thats gay firmware update help,0
good stuff,0
sure driving reach destination soon,0
lol alright thinkin haha,0
wont believe true incredible txts reply g learn truly amazing things blow mind ofwd ptxt,1
talk,0
must come later normally bathe da afternoon mah,0
course maths one day one chapter one month finish,0
asked hows anthony dad bf,0
photoshop makes computer shut,0
ure welcome caught u using broken english,0
jade paul didnåõt u txt u remember barmed want talk u txt,0
purity friendship two smiling reading forwarded messageits smiling seeing name gud evng musthu,0
hey gave photo registered driving ah tmr wanna meet yck,0
thts wat wright brother fly,0
finally came fix ceiling,0
good afternoon sunshine dawns day refreshed happy alive breathe air smile think love always,0
someone u know asked dating service contact cant guess call revealed pobox lshb p,1
sorry im getting feel really bad totally rejected kinda thing,0
hey sexy buns told adore loverboy hope remember thank sister law meatballs grins love babe,0
wanna laugh try chitchat mobile logon txting word chat send cm po box london wa zf pmsg rcvd,1
hi wont b ard christmas enjoy n merry xmas,0
know mallika sherawat yesterday find lturlgt,0
shower baby,0
oh way food fridge want go meal tonight,0
married local women looking discreet action real matches instantly phone text match msg cost p stop txt stop bcmsfwcnxx,1
lor,0
yup anything lor u dun wan ok,0
sir waiting mail,0
u look da lib got stuff havent finish yet,0
wamma get laidwant real doggin locations sent direct mobile join uks largest dogging network txt dogs nownyt eca lp å£msg,1
thats shame maybe cld meet hrs tomo,0
u still painting ur wall,0
c movie juz last minute decision mah juz watch lar tot ì interested,0
two letters copy cos one message speak soon,0
show wot say could u c dust,0
forwarded hi mailbox messaging sms alert messages matches please call back retrieve messages matches,1
jus came back fr lunch wif sis u leh,0
laptop noe infra slow lar wan fast one,0
need details online job,0
r u saying order slippers cos pay returning,0
okey doke im home dressed cos laying around ill speak later bout times stuff,0
thats rude campus,0
depends would like treated,0
spook mob halloween collection logo pic message plus free eerie tone txt card spook zed p per logopic,1
win winner mr foley ipod exciting prizes soon keep eye ur mobile visit wwwwincouk,1
telling tell one treat hi hi hi,0
single single answers fighting plus said broke didnt reply,0
guaranteed å£ award even å£ cashto claim ur award call free stop getstop php,1
sms ac sun posts helloyou seem cool,1
well general price ltgt oz let know ifwhenhow much want,0
carlosll minute still need buy,0
long get reply defer admission til next semester,0
urgent please call landline abta complimentary tenerife holiday å£ cash await collection sae tcs box cwwx ppm,1
ok come n pick u engin,0
got called tool,0
u better go sleep dun disturb u liao u wake msg lor,0
nope ill b going sch fri quite early lor cos mys sis got paper da morn,0
want mapquest something look usf dogwood drive,0
free ringtone waiting collected simply text password mix verify get usher britney fml,1
babes think got ur brolly left english wil bring mrw u luv franxx,0
romantic paris nights flights å£ book next year call tscs apply,1
stop old man get build snowman snow angels snowball fights,0
literally bed like ltgt hours,0
miss much im desparate recorded message left day listen hear sound voice love,0
ever green quote ever told jerry cartoon person irritates u always one loves u vry much fails express gud nyt,0
sorry brah finished last exams,0
ta jobs available let know please cos really need start working,0
tmr timin still da wat cos got lesson,0
dear voucher holder claim weeks offer pc please go httpwwwwtlpcouktext tscs apply,1
jokin lar depends phone father get lor,0
lovely night wake see message hope smile knowing great morning,0
youve tkts euro cup final å£ cash collect call b pobox ppm,1
getting back time soon,0
check rooms befor activities,0
babe goes day sip cappuccino think love send kiss across sea,0
well im going aunty,0
k k watch films,0
captain vijaykanth comedy captain tvhe drunken,0
nokia phone lovly,0
youll never believe actually got taunton wow,0
enjoy urself tmr,0
good morning plz call sir,0
better bb wont use wife doctor,0
ive trying reach without success,0
pansy youve living jungle two years driving worried,0
start sending blackberry torch nigeria find buyer melike month tell dad buy bb anyone oh,0
dont know come ask questions like dont mistake,0
picking various points going yeovil motor project hours u take home max easy,0
tables occupied im waiting tree,0
wish things different wonder able show much value pls continue brisk walks drugs without askin please find things laugh love dearly,0
know result,0
im leaving house,0
frens go lor alone wif mum n sis lor,0
yeah like goes like friends imma flip shit like half hour,0
solve case man found murdered ltdecimalgt ltgt afternoon wife called police police questioned everyone wife siri sleeping murder took place cook cooking gardener picking vegetables housemaid went post office children went play neighbour went marriage police arrested murderer immediately whos reply reason u r brilliant,0
,0
lasting much hours might get lucky,0
forgot tell ì smth ì like number sections clearer,0
dont want hear philosophy say happen,0
hey guy know breathing neck get bud anyway youd able get half track usf tonight,0
bothering trust answers pls,0
mths half price orange line rental latest camera phones free phone mths call mobilesdirect free update orstoptxt,1
printed oh ltgt come upstairs,0
yep pretty sculpture,0
urgent please call landline abta complimentary tenerife holiday cash await collection sae tcs box cwwx ppm,1
remember,0
ask say please message,0
getting anywhere damn job hunting,0
im coming home dinner,0
money steve mate,0
ditto wont worry saying anything anymore like said last night whatever want ill peace,0
congratulations ur awarded cd vouchers gift guaranteed free entry wkly draw txt music tncs wwwldewcomwinppmxage,1
sis catching e show e afternoon im watching w c u wan watch today tmr lor,0
valued customer pleased advise following recent review mob awarded å£ bonus prize call,1
im aight wats happening side,0
u dun wan u dun like already ah wat u still eating,0
ok r meeting later,0
never lei v lazy got wat dat day ì send da url cant work one,0
urgent nd attempt contact uu å£ call b tcsbcmwcnxx callcost ppm mobilesvary maxå£,1
hey come online use msn,0
fineabsolutly fine,0
dont use hook,0
ì send copy da report,0
honey pls find much sell predicte nigeria many times used important reply monday,0
nope c ì,0
natalie f inviting friend reply yes see wwwsmsacunataliek stop send stop frnd,1
yalru lyfu astne chikku bt innu mundhe lyf ali halla ke bilo marriageprogram edhae lyf nt yet ovr chikkuali vargu lyfu meow meowd,0
yesbut said,0
good trip watch remember get back must decide easter,0
ill b going sch mon sis need take smth,0
omg u know ate,0
hows favourite person today r u workin hard couldnt sleep last nite nearly rang u,0
yep great loxahatchee xmas tree burning ltgt starts hour,0
double mins txts months free bluetooth orange available sony nokia motorola phones call mobileupd calloptoutndx,1
mobile numberpls sms ur mail idconvey regards achanammarakheshqatar,0
hi kindly give us back documents submitted loan stapati,0
yesterday going home,0
sign maturity start saying big things actually start understanding small things nice evening bslvyl,0
urgent call landline complimentary ibiza holiday å£ cash await collection sae tcs po box sk wp ppm,1
havent add ì yet right,0
got tv watch meh u work today,0
u say leh course nothing happen lar say v romantic jus bit lor thk e nite scenery nice leh,0
called one pick e phone ask already said ok,0
youre right think,0
lemme know swing pick im free basically time semester,0
sent ur email id soon,0
hi chikku send nice msgs,0
petey boy whereare friendsare thekingshead come canlove nic,0
see,0
mobile months u r entitled update latest colour mobiles camera free call mobile update co free,1
yeah ill leave couple minutes amp let know get mu,0
hack chat get backdoor entry chat rooms fraction cost reply neo call subscribe p pm dps bcm box ldn wcnxx,1
sorry delay yes masters,0
dont necessarily expect done get back though im headin,0
good weekend,0
gonna ask lol think,0
hhahhaahahah rofl wtf nig leonardo room something,0
would im still cozy exhausted last nightnobody went school work everything closed,0
actually deleted old websitenow blogging magicalsongsblogspotcom,0
ìï go home liao ask dad pick,0
ok,0
ok lor msg b u call,0
yay cant wait party together,0
got ltgt,0
well might come,0
tirupur da started office call,0
r ì going todays meeting,0
think two still need get cash def ready,0
kthen come wenever u lik come also tel vikky come getting free time,0
thank winner notified sms good luck future marketing reply stop customer services,1
nothing smsing u n xy lor sorry lor da guys neva c u person sort know u lor u wan meet xy ask bring u along next meeting,0
pay ltdecimalgt lakhs,0
thank much selflessness love plenty,0
ur cashbalance currently pounds maximize ur cashin send cash pmsg cc hgsuitelands rowwjhl,1
normally hot mail com see,0
arrived see couple days lt,0
goodnight sleep well da please take care pa please,0
okmail dear dave final notice collect tenerife holiday cash award call landline tcs sae box cwwx ppm,1
yup already thanx printing n handing,0
much cost approx per month,0
customer service announcement recently tried make delivery unable please call reschedule ref,1
shall start hear,0
heart empty without love mind empty without wisdom eyes r empty without dreams amp life empty without frnds alwys touch good night amp sweet dreams,0
cds u congratulations ur awarded å£ cd gift vouchers å£ gift guaranteed freeentry å£ wkly draw xt music tncs wwwldewcomwinppmxage,1
yup wun believe wat u really neva c e msg sent shuhui,0
yet chikkugoing room nw im bus,0
staff placement training amrita college,0
ummmmmaah many many happy returns day dear sweet heart happy birthday dear,0
aiyo cos sms ì ì neva reply wait ì reply lar tot ì havent finish ur lab wat,0
hurt tease make cry end life die plz keep one rose grave say stupid miss u nice day bslvyl,0
making easy pay back ltgt yrs say pay back earlier get,0
yup n fren lor im meeting fren,0
hes lag thats sad part keep touch thanks skype,0
love holiday monday feeling even go dentists hour,0
