message,label
alright im outhave good night,0
text meet someone sexy today u find date even flirt u join p reply name age eg sam msg recdthirtyeight pence,1
true easier,0
important customer service announcement call freephone,1
got takes take part wrc rally oz u lucozade energy text rally le p see packs lucozadecoukwrc itcould u,1
getting threats sales executive shifad raised complaint official message,0
im really sorry lit hair fire,0
reach home safe n sound liao,0
sorry going home first daddy come fetch ì later,0
one,0
hi wkend ok journey terrible wk good huge back log marking,0
well shes big surprise,0
haha dont angry take practice real thing,0
happens r waxsto wat want come ill get medical insurance shell able deliver basic care im currently shopping right medical insurance give til friday morning thats ill see major person guide right insurance,0
mmmm cant wait lick,0
hot live fantasies call p per min ntt ltd po box croydon cr wb national rate call,1
bit ur smile hppnss drop ur tear sorrow part ur heart life heart like mine wil care u forevr goodfriend,0
means get door,0
sister belongs family hope tomorrow pray herwho fated shoranur train incident lets hold hands together amp fuelled love amp concern prior grief amp pain pls join dis chain amp pass stop violence women,0
lol would despite cramps like girl,0
pls pls drink plenty plenty water,0
ill hand phone chat wit u,0
specially selected receive award call lines close cost ppm tcs apply ag promo,1
wanted wish happy new year wanted talk legal advice gary split person ill make trip ptbo hope everything good babe love ya,0
friends help us problems give stupid suggestion lands us another problem helps us forgt previous problem,0
finished work yet,0
got ur favorite oyster n got favorite sashimi ok lar dun say already wait ur stomach start rumbling,0
urgent mobile number awarded å£ bonus caller prize call land line valid hrs,1
go fool dont cheat others ok,0
trying find chinese food place around,0
aight lemme know whats,0
wont wats wit guys,0
like made throw smoking friends car one time awesome,0
cant get da laptop matric card wif ì lei,0
dear reached railway happen,0
nan sonathaya soladha boss,0
hey thk juz go accordin wat discussed yest lor except kb sun cos theres nt much lesson go attend kb sat,0
please call customer service representative freephone ampm guaranteed å£ cash å£ prize,1
pain couldnt come worse time,0
beerage,0
shall come get pickle,0
gonna go get tacos,0
nite,0
new message please call,1
takes away money worries,0
yo yo yo byatch whassup,0
usually body takes care buy making sure doesnt progress pls continue talk saturday,0
important information orange user xxxxxx today ur lucky day find log onto httpwwwurawinnercom theres fantastic prizeawaiting,1
opinion jada kusruthi lovable silent spl character matured stylish simple pls reply,0
ìï send contents page,0
still checked da,0
oops sorry check dont mind picking tomo half eight station would ok,0
sorry cant help,0
im gonna say sorry would normal starting panic time sorry seeing tuesday,0
gone get info bt dont know,0
hi im always online yahoo would like chat someday,0
cool text youre ready,0
hi dis yijue would happy work wif ì gek,0
make lasagna vodka,0
hmmmy uncle informed hes paying school directly pls buy food,0
well theres lot things happening lindsay new years sighs bars ptbo blue heron something going,0
free st week nokia tone ur mob every week txt nokia get txting tell ur mates wwwgetzedcouk pobox wwq normptone,1
ok im waliking ard u wan buy anything go ur house,0
oh outside players allowed play know,0
thnx dude u guys nite,0
cbe really good nowadayslot shop showroomscity shaping good,0
cps causing outages conserve energy,0
watching cartoon listening music amp eve go temple amp church u,0
sad puppy noise,0
yunny im walking citylink ì faster come hungry,0
realise busy guy im trying bother get exams outta way try cars gr day,0
accordingly repeat text word ok mobile phone send,1
im also came room,0
hello got st andrewsboy long way cold keep posted,0
lol ouch wish id stayed bit longer,0
huh means computational science like dat one push n,0
cooked rather nice salmon la,0
big brotherû÷s really scraped barrel shower social misfits,0
purity friendship two smiling reading forwarded messageits smiling seeing name gud evng,0
mean left early check cos im working,0
dont want hear anything,0
oh sorry please,0
hospital da return home evening,0
idc get weaseling way shit twice row,0
shes drinkin im ok,0
wonderful okors great month cherish guys wish well day mojibiola,0
urgent mobile number awarded å£ prize guaranteed call land line claim valid hrs ppm,1
aight see bit,0
sorry mates phone didnt write love kate,0
wats ur opinion abt abt character,0
hellodrivbyquit edrunk sorry iff pthis makes senrddnot dancce drum n basqihave fun nhite x ros xxxxxxx,0
contacted dating service someone know find call land line poboxwtgp,1
message sent askin ltgt dollars shoul pay ltgt ltgt,0
nah dub je still buff,0
well know z take care worries,0
send email mind ltgt times per night,0
dear going rubber place,0
bluray player,0
ummmawill call check inour life begin qatar pls pray hard,0
im reaching another stops,0
todaysundaysunday holidayso work,0
si take mokka players,0
hello good week fancy drink something later,0
skallis wont play first two odi,0
real u getting yo need tickets one jacket im done already used multis,0
kkwhen going,0
yup bathe liao,0
mode men left,0
u turn heater heater set ltgt degrees,0
waiting call sir,0
still grinder,0
get gift year didnt get anything bad,0
haha cant tmr forfeit haha,0
hurry home u big butt hang last caller u food done im starving dont ask cooked,0
talk sexy make new friends fall love worlds discreet text dating service text vip see could meet,1
fineabsolutly fine,0
operate ltgt,0
im list buyers,0
back work morro half term u c nite sexy passion b go back chat luv dena calls å£minmobsmorelkpoboxhpfl,1
ìï come lt n pass lar,0
check rooms befor activities,0
rose redred bloodblood heartheart u u send tis ur friends including u like u get back u r poor relation u need support u r frnd many luvs u praying god marry u try,0
u made appointment,0
great safe trip dont panic surrender,0
message great doctor india drink appy fizz contains cancer causing age,0
sorry ill call later meeting,0
shes good r u working,0
ok,0
im meeting call later,0
dear denying words please,0
future planned tomorrow result today best present enjoy future,0
get ready moan scream,0
send ur friends receive something ur voice speaking expression childish naughty sentiment rowdy ful attitude romantic shy attractive funny ltgt irritating ltgt lovable reply,0
morning ok,0
hi darlin kate u doin somethin tonight im going pub called swan something parents one drink phone u,0
every day use sleep ltgt,0
umma life vava umma love lot dear,0
super msg danalla timing,0
ohi asked fun hahatake care ì,0
yeah wouldnt leave hour least hows sound,0
gumbys special ltgt cheese pizza know doin tonight,0
think iû÷m waiting bus inform get ever get,0
cant pick phone right pls send message,0
bought one ringtone getting texts costing pound offering tones etc,1
taking italian food pretty dress panties,0
well im glad didnt find totally disagreeable lol,0
come karnan car please wait till pm directly goto doctor,0
sounds better evening im costume im sure time finish tomorrow txt end,0
dont search love let love find u thats called falling love bcoz u dont force u fall u know smeone hold u bslvyl,0
ur changes da report big cos ive already made changes da previous report,0
lol well quality aint bad aint complaining,0
jolly good way give u tickets sat eve speak x,0
yes baby need stretch open pussy,0
ok gentleman treat dignity respect,0
u havenåõt lost ill always b ui didnåõt intend hurt u never knew u felt iwasmarinethatåõs itriedtell urmomi careabout u,0
hello love went day alright think sweet send jolt heart remind love hear screamed across sea world hear ahmad al hallaq loved owned possessive passionate kiss,0
dude avatar imp one point thought actually flies room almost tried hittng one reflex,0
important prevent dehydration giving enough fluids,0
donno scorable,0
,0
nope think go monday sorry replied late,0
fyi im taking quick shower epsilon like ltgt min,0
ok way railway,0
worries hope photo shoot went well spiffing fun workage,0
thought bout drink tap spile seven pub gas st broad st canal ok,0
time coming later,0
knew u slept v late yest wake late,0
go openings room til thanksgiving without upcharge,0
said gonna snow start around pm tonite predicting inch accumulation,0
cant pick phone right pls send message,0
per request maangalyam alaipayuthe set callertune callers press copy friends callertune,0
splashmobile choose gr tones wk subscrition service weekly tones costing p u one credit kick back enjoy,1
da car park,0
winner specially selected receive å£ cash å£ award speak live operator claim call ampm cost p,1
probably money worries things coming due several outstanding invoices work two three months ago,0
looks like u wil b getting headstart im leaving bout ish u r desperate company could head earlierwe goin meet rummer,0
lol grr mom taking forever prescription pharmacy like minutes away ugh,0
use foreign stamps whatever send,0
tell address,0
well little time thing good times ahead,0
hello damn christmas thing think decided keep mp doesnt work,0
okay ive seen pick friday,0
ok im sure time finish tomorrow wanna spend evening cos would vewy vewy lubly love xxx,0
wonders world th th ur style th ur smile th ur personality rd ur nature nd ur sms st ur lovely friendship good morning dear,0
sim subscriber selected receive bonus get delivered door txt word ok claim pmsg exp apr,1
opinion jada kusruthi lovable silent spl character matured stylish simple pls reply,0
please call customer service representative ampm guaranteed å£ cash å£ prize,1
thats fine got enough bud last night least,0
haha figures well found piece priscillas bowl,0
sis lor juz watched italian job,0
dude sux snake got old raiden got buff,0
also sir sent email log usc payment portal ill send another message explain things back home great weekend,0
mean website yes,0
man carlos definitely coming mu tonight excuses,0
room need,0
set place heart mind mind easily forgets heart always remember wish happy valentines day,0
send pic like,0
sorry ill call later,0
santa calling would little ones like call santa xmas eve call book time,1
sounds like something someone testing would sayy,0
wat makes people dearer de happiness dat u feel u meet de pain u feel u miss dem,0
someone contacted dating service entered phone fancy find call landline poboxntfp,1
going sao mu today done,0
come din c ì yup cut hair,0
dahe stupid daalways sending like thisdon believe messagepandy mental,0
boo babe u enjoyin yourjob u seemed b gettin well hunnyhope ure oktake care iåõllspeak u soonlots loveme xxxx,0
cool fun practicing making babies,0
ok arm feeling weak cuz got shot go another time,0
get home,0
urgent mobile awarded å£ bonus caller prize nd attempt contact call boxqu,1
sounds gd haha wah u yan jiu fast liao,0
great comedycant stop laughing da,0
hope alright babe worry might felt bit desparate learned job fake waiting come back love,0
im inside officestill filling formsdon know leave,0
dear voucher holder next meal us use following link pc enjoy dining experiencehttpwwwvouchmecometlpdiningasp,1
hmmmkbut want change field quickly dai wanna get system administrator network administrator,0
hard live chat pmin choose girl connect live call cheap chat uks biggest live service vu bcmwcnxx,1
nokia get win free auction take part send nokia hgsuitelands rowwjhl,1
love give massages use lots baby oil fave position,0
sleepingand surfing,0
didnt u call lunch,0
let ur heart ur compass ur mind ur map ur soul ur guide u never loose worldgnun sent via waysmscom,0
im meeting call later,0
win å£ shopping spree every week starting play text store skilgme tscs winawk age å£perweeksub,1
later guess needa mcat study,0
congrats mobile g videophones r call videochat wid mates play java games dload polyph music noline rentl,1
look amy ure beautiful intelligent woman like u lot know u donåõt like like donåõt worry,0
hello lover goes new job happy think wake slave send teasing kiss across sea,0
watching surya movie pm vijay movie pokkiri,0
oh ic thought meant mary jane,0
guy car shop flirting got phone number paperwork called texted im nervous course may address call boss tell knowing may get fired,0
forwarded please call immediately urgent message waiting,1
guess ithis first time created web page wwwasjesuscom read wrote im waiting opinions want friend,1
said kiss kiss cant sound effects gorgeous man isnt kind person needs smile brighten day,0
thanks da thangam feel happy dear also miss da,0
ok lor,0
eat shit wait ur monkey face bitch u asshole,0
heehee funny tho,0
dear know ltgt th ltgt th birthday loving gopalettan planning give small gift day like participate welcome please contact admin team details,0
usualiam fine happy amp well,0
ok da already planned wil pick,0
hope enjoyed new content text stop unsubscribe helpp provided tonesyoucouk,1
wat makes people dearer de happiness dat u feel u meet de pain u feel u miss dem,0
good donû÷t need receiptsûówell done û yes please tell whatû÷s number could ring,0
well keep mind ive got enough gas one round trip barring sudden influx cash,0
means february april ill getting place stay dont hustle back forth audition season since sister moved away harlem,0
love ass enjoy doggy style,0
cmon babe make horny turn txt fantasy babe im hot sticky need replies cost å£ cancel send stop,1
yup lunch buffet u eat already,0
mu try figure much money everyone gas alcohol jay trying figure weed budget,0
hey sathya till dint meet even single time saw situation sathya,0
cos darren say ì considering mah ask ì,0
said look pretty wif long hair wat thk hes cutting quite short leh,0
meanwhile shit suite xavier decided give us ltgt seconds warning samantha coming playing jays guitar impress shit also dont think doug realizes dont live anymore,0
going college pa else ill come self pa,0
sorry pain ok meet another night spent late afternoon casualty means havent done stuffmoro includes time sheets sorry,0
hmm thinking lor,0
joys father john john joys father u ans ths hav ltgt iq tis ias question try answer,0
shhhhh nobody supposed know,0
ok anybody asks abt u tel themp,0
new message call,1
yeah worse,0
piss talking someone realise u point itnow read backwards,0
much would cost hire hitman,0
gran onlyfound afew days agocusoon honi,0
yet hadya sapna aunty manege yday hogidhechinnu full weak swalpa black agidhane,0
come sec theres somebody want see,0
means got epi shes fine shes,0
yeah thats fine å£ get ok,0
walked hour c u doesnåõt show care wont u believe im serious,0
said would woke,0
guess somebody know secretly fancies wanna find give us call landline dateboxessexcmxn pmin,1
sun anti sleep medicine,0
u secret admirer looking make contact ufind rreveal thinks ur specialcall,1
time thinkin goin,0
youwhen wil reach,0
honey sweetheart darling sexy buns sugar plum loverboy miss boytoy smacks ass go gym,0
oi gonna ring,0
entered cabin pa said happy bday boss felt special askd lunch lunch invited apartment went,0
printer cool mean groovy wine groovying,0
god blessget good sleep deari pray,0
anything special,0
pls stop bootydelious f inviting friend reply yes see wwwsmsacubootydelious stop send stop frnd,1
im awake oh whats,0
ltgt bucks banks fees fixed better call bank find,0
dhoni luck win big titleso win,0
hiya u like hlday pics looked horrible took mo hows camp amrca thing speak soon serena,0
hmph go head big baller,0
love aathilove u lot,0
wana plan trip sometme,0
idea soon get converted live,0
ì wan meet n combine parts hows da rest da project going,0
happened interview,0
xmas offer latest motorola sonyericsson nokia free bluetooth dvd double mins txt orange call mobileupd calloptoutqf,1
dont worry day big lambu ji vl cometil enjoy batchlor party,0
alrite,0
ìï mean confirmed tot juz say oni ok,0
tell make little spreadsheet track whose idea smoke determine smokes much entire month february,0
good evening sir al salam wahleykkumsharing happy newsby grace god got offer tayseertissco joinedhope fineinshah allahmeet sometimerakheshvisitor india,0
nationwide auto centre something like newport road liked,0
hey booked kb sat already lessons going ah keep sat night free need meet confirm lodging,0
deep sigh miss really surprised havent gone net cafe yet get dont miss,0
ur lecture,0
hi missed call mumhas beendropping red wine theplace adress,0
babe fucking love know fuck good hear voice need crave cant get enough adore ahmad kisses,0
gd luck ur exams,0
feel like dick keep sleeping texts facebook messages sup town,0
im movie collect car oredi,0
thats good need drugs,0
still grand prix,0
well medical missions nigeria,0
forget tell want need crave love sweet arabian steed mmmmmm yummy,0
hi msg meim office,0
u coming funeral home,0
head straight,0
gr see message r u leaving congrats dear school wat r ur plans,0
although told u dat im baig face watches really like e watch u gave cos fr u thanx everything dat uve done today im touched,0
dear voucher holder claim weeks offer pc please go httpwwwetlpcoukreward tscs apply,1
every mondaynxt week vl completing,0
sweet heart,0
reach ur home ltgt minutes,0
haha get used driving usf man know lot stoners,0
ok askd u knw tht,0
anyway im going shopping cos sis done yet dun disturb u liao,0
urgent nd attempt contact uu å£call b tcsbcmwcnxxcallcostppmmobilesvary maxå£,1
hey happy birthday,0
bring tat cd forget,0
know shall speak ltgt minutes,0
thanks understanding ive trying tell sura,0
surely result offer,0
ì go buy wif meet ì later,0
hcl chennai requires freshers voice processexcellent english neededsalary upto ltgt call mssuman ltgt telephonic interview via indyarockscom,0
one joys lifeis waking daywith thoughts somewheresomeone cares enough tosend warm morning greeting,0
sister going earn da,0
dunno lei thk mum lazy go neva ask yet,0
normal,0
ok thats great thanx lot,0
shall get pouch,0
carlos taking sweet time usual let know patty donewant smoke ill tell haul ass,0
get ten billion calls texts help god,0
blank blank wat blank lol,0
want custom officer discount oh,0
almost see u sec,0
reach office around ltdecimalgt amp mobile problem cannt get voice call asa ill free,0
yeah get unlimited,0
yup ok thanx,0
u r winner u ave specially selected receive å£ cash holiday flights inc speak live operator claim pmin,1
hi probably much fun get message thought id txt u cos im bored james farting night,0
iû÷ve got salt rub open wounds like,0
ok bag,0
gimme ltgt minutes ago,0
sms auction nokia get win free auction take part send nokia hgsuitelands rowwjhl,1
channel,0
free video camera phones half price line rental mths cross ntwk mins txts call mobileupd calloptout,1
much payed suganya,0
compliments away system side,0
latest nokia mobile ipod mp player å£ proze guaranteed reply win norcorp ltdå£mtmsgrcvd,1
sucks got planned yo valentine yo valentine arent,0
pa selected,0
busy trying finish new year looking forward finally meeting,0
still havent collected dough pls let know go place sent get control number,0
someone u know asked dating service contact cant guess call revealed po box wu,1
babe talking think good boy missing love,0
agree stop thinkin ipad please ask macho question,0
perhaps much easy give account identification tomorrow uni,0
im bus love,0
one small prestige problem,0
came look flat seems ok away alot wiv work got woman coming,0
urgent ur awarded complimentary trip eurodisinc trav acoentry å£ claim txt dis å£morefrmmob shracomorsglsuplt ls aj,1
happy new year u ur familymay new year bring happiness stability tranquility ur vibrant colourful life,0
yeah ill leave maybe ish,0
got tallent wasting,0
december mobile mths entitled update latest colour camera mobile free call mobile update vco free,1
lol great im getting hungry,0
sun cant come earth send luv rays cloud cant come river send luv rain cant come meet u send care msg u gud evng,0
thanks message really appreciate sacrifice im sure process direct pay find way back test tomorrow im class wonderful day,0
costa del sol holiday å£ await collection call toclaim sae tc pobox stockport skxh costå£pm maxmins,1
audrie lousy autocorrect,0
oh forwarded message thought send,0
multiply numbers independently count decimal points division push decimal places like showed,0
released another italian one today cosign option,0
r u meeting da ge nite tmr,0
whatever juliana whatever want,0
hiya stu wot u im much truble home moment evone hates even u wot hell av done wont u tell text bck please luv dan,0
remain unconvinced isnt elaborate test willpower,0
im thinking chennai forgot come auction,0
watching tv lor nice one like lor,0
please send auntys number,0
remember ask alex pizza,0
guaranteed latests nokia phone gb ipod mp player å£ prize txt wordcollect tcllc nyusa pmt msgrcvd,1
come ur home,0
ìï takin linear algebra today,0
entered cabin pa said happy bday boss felt special askd lunch lunch invited apartment went,0
couldnt say dying man feel sad go wanted know would probably gone late night,0
everything weather keep extra warm cold nothing serious pls lots vitamin c,0
babe u want dont u baby im nasty thing filthyguys fancy rude time sexy bitch go slo n hard txt xxx slomsgs,1
finish meeting call,0
know dad back,0
thk em find wtc far weiyi goin e rest dunno yet r ur goin dinner den might b able join,0
lol u still feeling sick,0
hi shanilrakhesh herethanksi exchanged uncut diamond stuffleaving back excellent service dino prem,0
girls many local u r virgins r ready fil ur every sexual need u fil text cute å£p,1
jus finish watching tv u,0
masters buy bb cos sale hows bf,0
sorry ill call later meeting,0
certainly puts things perspective something like happens,0
themobhit link get premium pink panther game new sugababes crazy zebra animation badass hoody wallpaperall free,1
hii got money da,0
lol mad first woke gave,0
tired special,0
happen,0
need buy lunch eat maggi mee,0
much textin bout,0
winner u specially selected receive å£ cash holiday flights inc speak live operator claim,1
mm way railway,0
sea lays rock rock envelope envelope paper paper words,0
bored housewives chat n date btnational rate pmin landlines,1
r u yet im wearing blue shirt n black pants,0
hello madam,0
keep ten rs shelf buy two egg,0
quite late lar ard anyway wun b drivin,0
ok much though hm friday cant wait dunno wot hell im gonna another weeks become slob oh wait already done,0
lovely night xxx,0
well weather calis great complexities great need car move freely taxes outrageous great place sad part missing home,0
late,0
auntie huai juan never pick phone,0
ok lor ì reaching message,0
hi babe im home wanna something xx,0
ill sch fr dun haf da book sch home,0
yes nigh cant aha,0
hi ibh customer loyalty offer new nokia mobile å£ txtauctiontxt wordstart get nowt,1
ok may free gym,0
da vijay going talk jaya tv,0
give sec think think,0
wanna get laid nite want real dogging locations sent direct ur mobile join uks largest dogging network txt park nyt eca lp å£msg,1
done,0
hi dude hw r u da realy mising u today,0
okie,0
taking part mobile survey yesterday texts use however wish get txts send txt tc wwwtxtcom p,1
want show world princess europe,0
yeah thatd pretty much best case scenario,0
freemsg txt call claim reward hours talk time use phone subscribegbpmnth inc hrs stoptxtstop,1
studies alone without anyones help cant need study,0
call say coming today ok tell fool like ok,0
ì wait bus stop aft ur lect lar dun c ì go get car come back n pick ì,0
juz go google n search qet,0
hanging brother family,0
yupz ive oredi booked slots weekends liao,0
oh rite well im best mate pete went week geva longer week,0
remember hurt days satanic imposter meneed pay priceso itmay destiny keep going u said pray get mind get,0
birthday feb ltgt da,0
dude whats teresa hope okay didnt hear people called received package since dec ltgt thot yould like know fantastic year best reading plus really really bam first aid usmle work done,0
lot sickness thing going round take easy hope u feel better soon lol,0
meant calculation ltgt units ltgt school really expensive started practicing accent important decided years dental school youll nmde exam,0
erm woodland avenue somewhere get parish magazine telephone number,0
running managed minutes needed oxygen might resort roller option,0
yeshe really greatbhaji told kallis best cricketer sachin worldvery tough get,0
great role model giving much really wish day miracle god reason everything must say wish knew dont ive looked since young still great day,0
busy come point figure tomorrow,0
dont cancer moms making big deal regular checkup aka pap smear,0
whore unbelievable,0
cash prize claim call tc rstm sw ss ppm,1
shant disturb u anymore jia,0
guess wants alone time could show watch,0
detroit home snow enjoy,0
important information orange user today lucky dayfind log onto httpwwwurawinnercom theres fantastic surprise awaiting,1
need ke qi ìï bored izzit suddenly thk,0
machan go gym tomorrow wil come late goodnight,0
cant right second gotta hit people first,0
please dont say like hi hi hi,0
get ur st ringtone free reply msg tone gr top tones phone every week å£ per wk opt send stop,1
call later dont network urgnt sms,0
sent de webadres geting salary slip,0
watching tv lor,0
sorry ill call later,0
urgent trying contact last weekends draw shows å£ prize guaranteed call claim code k valid hours,1
like ltgt question,0
yesmum lookin strong,0
urgent mobile xxxxxxxxx å£ bonus caller prize nd attempt reach call asap,1
aight time want come,0
want explicit sex secs ring costs pmin,1
call ure done,0
